swiss,Symbol,Fund Type,MasterDATA
Vanguard S&P Small-Cap 600 Value ETF,VIOV,US Equity ETF,_
Vanguard Short-Term Bond ETF,BSV,Fixed Income ETF,_
Vanguard Short-Term Corporate Bond ETF,VCSH,Fixed Income ETF,_
Vanguard Short-Term Government Bond ETF,VGSH,Fixed Income ETF,_
Vanguard Shrt-Term Infl-Prot Sec Idx ETF,VTIP,Fixed Income ETF,_
Vanguard Small-Cap ETF,VB,US Equity ETF,_
Vanguard Small-Cap Growth ETF,VBK,US Equity ETF,_
Vanguard Small-Cap Value ETF,VBR,US Equity ETF,_
Vanguard Telecom ETF - DNQ ETF,VOX,US Equity ETF,_
Vanguard Total Bond Market ETF,BND,Fixed Income ETF,_
Vanguard Total International Stock ETF,VXUS,Global Equity ETF,_
Vanguard Total Intl Bd Idx ETF,BNDX,Fixed Income ETF,_
Vanguard Total Stock Market ETF,VTI,US Equity ETF,_
Vanguard Total World Stock ETF,VT,Global Equity ETF,_
Vanguard Utilities ETF - DNQ ETF,VPU,US Equity ETF,_
Vanguard Value ETF,VTV,US Equity ETF,_
VelocityShares Emerging Asia DR ETF,ASDR,Global Equity ETF,_
VelocityShares Emerging Markets DR ETF,EMDR,Global Equity ETF,_
VelocityShares Russia Select DR ETF,RUDR,Global Equity ETF,_
WisdomTree Asia Local Debt Fund ETF,ALD,Commodity Based ETF*,_
WisdomTree Asia Pacific ex-Japan Fund ETF,AXJL,Global Equity ETF,_
WisdomTree Australia & New Zealand Debt Fund,AUNZ,Fixed Income ETF,_
WisdomTree Australia Dividend Fund ETF,AUSE,Global Equity ETF,_
WisdomTree China Dividend ex-Fincls ETF,CHXF,Fixed Income ETF,_
WisdomTree Commodity Country Equity Fund ETF,CCXE,Global Equity ETF,_
WisdomTree DEFA Fund ETF,DWM,Equity ETF,_
WisdomTree DEFA High-Yielding Equity Fund ETF,DTH,Equity ETF,_
WisdomTree Dividend Top 100 Fund ETF,DTN,Equity ETF,1
WisdomTree Dreyfus Brazilian Real Fund ETF,BZF,Commodity Based ETF*,_
WisdomTree Dreyfus Chinese Yuan Fund ETF,CYB,Commodity Based ETF*,_
WisdomTree Dreyfus Commodity Currency Fund ETF,CCX,Commodity Based ETF*,_
WisdomTree Dreyfus Emerging Currency ETF,CEW,Commodity Based ETF,_
WisdomTree Dreyfus Euro Fund ETF,EU,Fixed Income ETF,_
WisdomTree Dreyfus Indian Rupee Fund ETF,ICN,Commodity Based ETF*,_
WisdomTree Earnings 500 Fund ETF,EPS,Equity ETF,_
WisdomTree Emer Mkts Corporate Bond ETF,EMCB,Fixed Income ETF,_
WisdomTree Emerging Market SmallCap Fund ETF,DGS,Equity ETF,_
WisdomTree Emerging Markets High-Yielding Fund ETF,DEM,Global Equity ETF,_
WisdomTree Emerging Markets Local Debt Fund ETF,ELD,Commodity Based ETF*,_
WisdomTree Europe High-Yielding Equity Fund ETF,DEW,Equity ETF,_
WisdomTree Europe SmallCap Dividend Fund ETF,DFE,Equity ETF,_
WisdomTree Global Corporate Bond ETF,GLCB,Fixed Income ETF,_
WisdomTree Global ex-U.S. Growth Fund ETF,DNL,Equity ETF,_
WisdomTree Global ex-U.S. Real Estate Fund ETF,DRW,Equity ETF,_
WisdomTree Global ex-U.S. Utility Fund ETF,DBU,Global Equity ETF,_
WisdomTree Global Natural Resources Fund ETF,GNAT,Equity ETF,_
WisdomTree Global Real Return Fund ETF,RRF,Commodity Based ETF*,_
WisdomTree High-Yielding Equity Fund ETF,DHS,Equity ETF,2
WisdomTree India Earnings Fund ETF,EPI,Equity ETF,_
WisdomTree International Dividend Top 100 Fund ETF,DOO,Equity ETF,_
WisdomTree International Hedged Equity Fund ETF,HEDJ,Commodity Based ETF*,_
WisdomTree International LargeCap Dividend Fund ETF,DOL,Equity ETF,_
WisdomTree International MidCap Dividend Fund ETF,DIM,Equity ETF,_
WisdomTree International SmallCap Fund ETF,DLS,Equity ETF,_
WisdomTree Japan SmallCap Fund ETF,DFJ,Equity ETF,_
WisdomTree Japan Total Dividend Fund ETF,DXJ,Commodity Based ETF*,_
WisdomTree LargeCap Dividend Fund ETF,DLN,Equity ETF,2
WisdomTree Low P/E Fund ETF,EZY,Equity ETF,_
WisdomTree Managed Futures Strategy Fund ETF,WDTI,Commodity Based ETF*,_
WisdomTree MidCap Dividend Fund ETF,DON,Equity ETF,1
WisdomTree MidCap Earnings Fund ETF,EZM,Equity ETF,_
WisdomTree Middle East Dividend ETF,GULF,Equity ETF,_
WisdomTree SmallCap Earnings Fund ETF,EES,Equity ETF,_
WisdomTree Total Dividend Fund ETF,DTD,Equity ETF,_
WisdomTree Total Earnings Fund ETF,EXT,Equity ETF,_
WisdomTree Trust SmallCap Dividend Fund ETF,DES,US Equity ETF,1
WisdomTree US Dividend Growth,DGRW,Global Equity ETF,_
Yorkville High Income Infras MLP ETF,YMLI,Fixed Income ETF,_
Yorkville High Income MLP ETF,YMLP,US Equity Income ETF,_
